{
    "id": "fdsa",
    "revision": 0,
    "parts": [
        {
            "id": "demon-wings",
            "variant": "$",
            "fill": {
                "p0demon-wingslayer1": "#D00",
                "p1demon-wingslayer2": "#666"
            }
        },
        {
            "id": "basic-body",
            "variant": "$",
            "fill": {
                "p0basic-bodylayer1": "#D00"
            }
        }
    ],
    "meta": {
        "name": "Example",
        "tags": [],
        "description": "Neat",
        "author": "Douglas Richardson"
    },
    "created": ""
}